{
  "schemaVersion": 1,
  "commitId": "cmt-33333333-3333-7333-8333-333333333333",
  "captureId": "cap-33333333-3333-7333-8333-333333333333",
  "revision": 1,
  "endedAt": "2026-07-22T10:02:00Z",
  "streamSummaries": [
    {
      "streamId": "stream-33333333-3333-7333-8333-333333333333",
      "firstSequence": 0,
      "lastSequence": 15,
      "observationCount": 16
    }
  ],
  "orderedObservationDigest": "054a6fb25bc7851624d2ab5d20015948ebae21ff0e3efc763ec43bb53276b021",
  "artifactCount": 0,
  "artifactSetDigest": "e3b0c44298fc1c149afbf4c8996fb92427ae41e4649b934ca495991b7852b855",
  "gaps": []
}
